{
  "bundle_hash": "6035fba3bdd3d7505f91df3e27f63f228fe6293c04b3e7d37d6a3533f75e8552",
  "interop_version": "rdllm-interop/v1",
  "receipt_credential": {
    "@context": [
      "https://www.w3.org/ns/credentials/v2",
      "https://rdllm.local/contexts/rdllm/v1"
    ],
    "credentialSubject": {
      "answerHash": "069df2b36f4c12ee438a0edb55cc944c675fb5f3802cb70592907f047916ac51",
      "attributionGapCommitment": "fbf214afe55b7abdd41ee1d1b2f79190354f886d7753383ac532d51090820dc3",
      "attributionGapVerdict": "closed",
      "claimCommitment": "5405f1c9f37f039cf49a48a2705b45fc8c5f20e9603c43c8c682f9105b302111",
      "claimCount": 6,
      "claimSupportTraceHash": "5405f1c9f37f039cf49a48a2705b45fc8c5f20e9603c43c8c682f9105b302111",
      "creatorPool": "0.550000",
      "creatorPoolRate": "0.55",
      "disclosureRoot": "665c853fa8f92faef654cb8bdd09df32056eadc26216c7b481407543ecbde00b",
      "disclosureVersion": "rdllm-selective-disclosure/v1",
      "eventHash": "1ed43e106d466249fb8efc2e529d4c5b81271493b74c3947fd6eda07bdd5b515",
      "groundingQualityVerdict": "verified",
      "groundingStatus": "grounded",
      "id": "urn:rdllm:event:evt_1ed43e106d466249",
      "model": {
        "id": "model:unspecified",
        "route_id": "route:default",
        "version": "unknown"
      },
      "policyStatus": "allowed",
      "promptHash": "3ff9b4d52e3ba4909f885835c6d362c80d35db9cafec55166ee62a73722aa7c6",
      "receiptHash": "65ef394871de5d4a1ebd0fe8fd3d14d6cbd335c277ddcf0ad262b481f45600f7",
      "registryCommitment": "5cf8ca9f61e7c56bcd20956c26d47dba5461408fc84dcce471f90df8c5d44551",
      "registryStatus": "clear",
      "renderedOutputHash": "c66b2c1422709b0dbfcd955f72a60589dc625e19b870129120fe494bdae442b1",
      "rightsCommitment": "05ed2aae62c637df14eca70066161c6607b3821b036794fd66b2efccd80329a4",
      "shareCommitment": "dad60e231e4b0b78ecb711f51a332f42d8cf80d8d7e4f15afa8a2eded29dadd7",
      "sourceAccessCommitment": "9a585e20f993e8459f624551c8530f197912d3a7b79b2fc695962d0c19001d40",
      "sourceAccessCount": 6,
      "sourceAccessTraceHash": "9a585e20f993e8459f624551c8530f197912d3a7b79b2fc695962d0c19001d40",
      "sourceCommitment": "d259ae4a9a16ee41ccf8a5a46822b255e1a12c3ced83d77d5806dc31b9115a91",
      "sourceCount": 3,
      "sourceReferenceTraceHash": "d259ae4a9a16ee41ccf8a5a46822b255e1a12c3ced83d77d5806dc31b9115a91",
      "traceExchangeVersion": "rdllm-trace-exchange/v1"
    },
    "evidence": [
      {
        "chunkId": "arjun-provenance-ledger:c1",
        "contentHash": "e94efa6d9bb390d4771529cf4333dcb0acb75db9f9d65e0162832223f2b8a45f",
        "creatorId": "arjun",
        "evidenceSpanHashes": [
          "399e7ff82b806e565de7e3985f11ff54bb00ce925e6ccd6c4327f412ac297f6e",
          "6ea90fbdd0fb8fcc7aec2615c76ef5e5238e82e459f62189f265905639462c54"
        ],
        "sourceLabel": "S1",
        "sourceUri": "registered://works/arjun-provenance-ledger#arjun-provenance-ledger:c1",
        "type": "RDLLMSourceEvidence",
        "workId": "arjun-provenance-ledger"
      },
      {
        "chunkId": "lina-governance-disputes:c1",
        "contentHash": "2e332f1761339f67c61a38603786bb8651fdfa8ce9ef6e924517c113a2d7e0ac",
        "creatorId": "lina",
        "evidenceSpanHashes": [
          "71e11e089ebe72376e5099eb3f9ade96cf587ca11a6e9d3d60bfd49ca0423baa",
          "82b19c7059e78ab87624c79ca85b89461095efd5a20dc0a2a50c16643ab4a26c"
        ],
        "sourceLabel": "S2",
        "sourceUri": "registered://works/lina-governance-disputes#lina-governance-disputes:c1",
        "type": "RDLLMSourceEvidence",
        "workId": "lina-governance-disputes"
      },
      {
        "chunkId": "maya-youtube-style-pool:c1",
        "contentHash": "6029417218e901f1781ae5d7ee42f62b1f84a62e3977421600a30fce280b9ec7",
        "creatorId": "maya",
        "evidenceSpanHashes": [
          "28528b6fc0dbfca22581220c07e210b8b25f663a5ac1108ef3b1d2a69801cdce",
          "a9ed8431a2594a128f8d8b335e103649ebdfe5c322e03c84a6f270852f1a7145"
        ],
        "sourceLabel": "S3",
        "sourceUri": "registered://works/maya-youtube-style-pool#maya-youtube-style-pool:c1",
        "type": "RDLLMSourceEvidence",
        "workId": "maya-youtube-style-pool"
      },
      {
        "chunkId": "arjun-provenance-ledger:c1",
        "claimHash": "399e7ff82b806e565de7e3985f11ff54bb00ce925e6ccd6c4327f412ac297f6e",
        "claimId": "claim:1",
        "evidenceSpanHash": "399e7ff82b806e565de7e3985f11ff54bb00ce925e6ccd6c4327f412ac297f6e",
        "sourceLabel": "S1",
        "supported": true,
        "type": "RDLLMClaimEvidence",
        "workId": "arjun-provenance-ledger"
      },
      {
        "chunkId": "arjun-provenance-ledger:c1",
        "claimHash": "6ea90fbdd0fb8fcc7aec2615c76ef5e5238e82e459f62189f265905639462c54",
        "claimId": "claim:2",
        "evidenceSpanHash": "6ea90fbdd0fb8fcc7aec2615c76ef5e5238e82e459f62189f265905639462c54",
        "sourceLabel": "S1",
        "supported": true,
        "type": "RDLLMClaimEvidence",
        "workId": "arjun-provenance-ledger"
      },
      {
        "chunkId": "lina-governance-disputes:c1",
        "claimHash": "71e11e089ebe72376e5099eb3f9ade96cf587ca11a6e9d3d60bfd49ca0423baa",
        "claimId": "claim:3",
        "evidenceSpanHash": "71e11e089ebe72376e5099eb3f9ade96cf587ca11a6e9d3d60bfd49ca0423baa",
        "sourceLabel": "S2",
        "supported": true,
        "type": "RDLLMClaimEvidence",
        "workId": "lina-governance-disputes"
      },
      {
        "chunkId": "lina-governance-disputes:c1",
        "claimHash": "82b19c7059e78ab87624c79ca85b89461095efd5a20dc0a2a50c16643ab4a26c",
        "claimId": "claim:4",
        "evidenceSpanHash": "82b19c7059e78ab87624c79ca85b89461095efd5a20dc0a2a50c16643ab4a26c",
        "sourceLabel": "S2",
        "supported": true,
        "type": "RDLLMClaimEvidence",
        "workId": "lina-governance-disputes"
      },
      {
        "chunkId": "maya-youtube-style-pool:c1",
        "claimHash": "28528b6fc0dbfca22581220c07e210b8b25f663a5ac1108ef3b1d2a69801cdce",
        "claimId": "claim:5",
        "evidenceSpanHash": "28528b6fc0dbfca22581220c07e210b8b25f663a5ac1108ef3b1d2a69801cdce",
        "sourceLabel": "S3",
        "supported": true,
        "type": "RDLLMClaimEvidence",
        "workId": "maya-youtube-style-pool"
      },
      {
        "chunkId": "maya-youtube-style-pool:c1",
        "claimHash": "a9ed8431a2594a128f8d8b335e103649ebdfe5c322e03c84a6f270852f1a7145",
        "claimId": "claim:6",
        "evidenceSpanHash": "a9ed8431a2594a128f8d8b335e103649ebdfe5c322e03c84a6f270852f1a7145",
        "sourceLabel": "S3",
        "supported": true,
        "type": "RDLLMClaimEvidence",
        "workId": "maya-youtube-style-pool"
      }
    ],
    "id": "urn:rdllm:receipt:65ef394871de5d4a1ebd0fe8fd3d14d6cbd335c277ddcf0ad262b481f45600f7",
    "issuer": "rdllm-local-demo",
    "proof": {
      "created": "2026-05-29T18:53:27Z",
      "cryptosuite": "rdllm-hmac-sha256-2026",
      "proofPurpose": "assertionMethod",
      "proofValue": "f39b44eb39daf11b6b890313cca849f9a0f40fb6f5d4015f802a06ae4b3aab1a",
      "type": "DataIntegrityProof",
      "verificationMethod": "rdllm-local-demo#rdllm-attribution-key"
    },
    "type": [
      "VerifiableCredential",
      "RDLLMAttributionReceiptCredential"
    ],
    "validFrom": "2026-05-29T18:53:27Z"
  },
  "receipt_hash": "65ef394871de5d4a1ebd0fe8fd3d14d6cbd335c277ddcf0ad262b481f45600f7",
  "receipt_prov_graph": {
    "@context": {
      "prov": "http://www.w3.org/ns/prov#",
      "rdllm": "https://rdllm.local/ns#"
    },
    "activities": [
      {
        "generated": "urn:rdllm:answer:c66b2c1422709b0dbfcd955f72a60589dc625e19b870129120fe494bdae442b1",
        "groundingStatus": "grounded",
        "id": "urn:rdllm:activity:evt_1ed43e106d466249",
        "model": {
          "id": "model:unspecified",
          "route_id": "route:default",
          "version": "unknown"
        },
        "startedAtTime": "2026-05-29T18:53:27Z",
        "type": "rdllm:GenerationAttribution",
        "used": [
          "urn:rdllm:prompt:3ff9b4d52e3ba4909f885835c6d362c80d35db9cafec55166ee62a73722aa7c6",
          "urn:rdllm:source:arjun-provenance-ledger:c1:e94efa6d9bb390d4",
          "urn:rdllm:source:lina-governance-disputes:c1:2e332f1761339f67",
          "urn:rdllm:source:maya-youtube-style-pool:c1:6029417218e901f1"
        ]
      }
    ],
    "agents": [
      {
        "id": "urn:rdllm:issuer:97d133d2a78bd60a",
        "name": "rdllm-local-demo",
        "role": "issuer",
        "type": "prov:Agent"
      },
      {
        "id": "urn:rdllm:model:aa63318b78b0ed6e",
        "name": "model:unspecified",
        "routeId": "route:default",
        "type": "prov:SoftwareAgent",
        "version": "unknown"
      },
      {
        "creatorId": "arjun",
        "id": "urn:rdllm:creator:arjun",
        "name": "Arjun Rao",
        "role": "creator",
        "type": "prov:Agent"
      },
      {
        "creatorId": "lina",
        "id": "urn:rdllm:creator:lina",
        "name": "Lina Park",
        "role": "creator",
        "type": "prov:Agent"
      },
      {
        "creatorId": "maya",
        "id": "urn:rdllm:creator:maya",
        "name": "Maya Sen",
        "role": "creator",
        "type": "prov:Agent"
      }
    ],
    "entities": [
      {
        "id": "urn:rdllm:prompt:3ff9b4d52e3ba4909f885835c6d362c80d35db9cafec55166ee62a73722aa7c6",
        "promptHash": "3ff9b4d52e3ba4909f885835c6d362c80d35db9cafec55166ee62a73722aa7c6",
        "type": "rdllm:PromptCommitment"
      },
      {
        "answerHash": "069df2b36f4c12ee438a0edb55cc944c675fb5f3802cb70592907f047916ac51",
        "id": "urn:rdllm:answer:c66b2c1422709b0dbfcd955f72a60589dc625e19b870129120fe494bdae442b1",
        "renderedOutputHash": "c66b2c1422709b0dbfcd955f72a60589dc625e19b870129120fe494bdae442b1",
        "type": "rdllm:RenderedOutput"
      },
      {
        "chunkId": "arjun-provenance-ledger:c1",